{
  "$schema": "http://json-schema.org/draft-04/schema#",
  "type": "object",
  "properties": {
    "event": {
      "type": "string"
    },
    "message": {
      "type": "string"
    },
    "sent_at": {
      "type": "string",
      "format": "date-time"
    },
    "user": {
      "type": "object",
      "properties": {
        "id": {
          "type": "string"
        },
        "username": {
          "type": "string"
        },
        "name": {
          "type": [
            "string",
            "null"
          ]
        },
        "gravatar_uid": {
          "type": [
            "string",
            "null"
          ]
        }
      },
      "required": [
        "id",
        "username",
        "name",
        "gravatar_uid"
      ]
    },
    "project": {
      "type": "object",
      "properties": {
        "id": {
          "type": "string"
        },
        "name": {
          "type": "string"
        },
        "main_format": {
          "type": [
            "string",
            "null"
          ]
        },
        "created_at": {
          "type": "string",
          "format": "date-time"
        },
        "updated_at": {
          "type": "string",
          "format": "date-time"
        }
      },
      "required": [
        "id",
        "name",
        "main_format",
        "created_at",
        "updated_at"
      ]
    },
    "branch": {
      "type": "object",
      "properties": {
        "name": {
          "type": "string"
        }
      },
      "required": [
        "name"
      ]
    },
    "job": {
      "type": "object",
      "title": "job",
      "properties": {
        "id": {
          "type": "string"
        },
        "name": {
          "type": [
            "string",
            "null"
          ]
        },
        "owner": {
          "type": "object",
          "properties": {
            "id": {
              "type": "string"
            },
            "username": {
              "type": "string"
            },
            "name": {
              "type": [
                "string",
                "null"
              ]
            }
          },
          "required": [
            "id",
            "username",
            "name"
          ]
        },
        "briefing": {
          "type": [
            "string",
            "null"
          ]
        },
        "due_date": {
          "type": [
            "string",
            "null"
          ],
          "format": "date-time"
        },
        "review_due_date": {
          "type": [
            "string",
            "null"
          ],
          "format": "date-time"
        },
        "state": {
          "type": [
            "string",
            "null"
          ]
        },
        "ticket_url": {
          "type": [
            "string",
            "null"
          ]
        },
        "created_at": {
          "type": "string",
          "format": "date-time"
        },
        "updated_at": {
          "type": "string",
          "format": "date-time"
        }
      },
      "required": [
        "id",
        "name",
        "owner",
        "briefing",
        "due_date",
        "state",
        "ticket_url",
        "created_at",
        "updated_at"
      ]
    },
    "locale": {
      "type": "object",
      "properties": {
        "id": {
          "type": "string"
        },
        "name": {
          "type": "string"
        },
        "code": {
          "type": "string"
        },
        "default": {
          "type": "boolean"
        },
        "main": {
          "type": "boolean"
        },
        "rtl": {
          "type": "boolean"
        },
        "plural_forms": {
          "type": "array",
          "items": {
            "type": "string"
          }
        },
        "source_locale": {
          "type": [
            "object",
            "null"
          ],
          "properties": {
            "id": {
              "type": "string"
            },
            "name": {
              "type": "string"
            },
            "code": {
              "type": "string"
            }
          },
          "required": [
            "id",
            "name",
            "code"
          ]
        },
        "fallback_locale": {
          "type": [
            "object",
            "null"
          ],
          "properties": {
            "id": {
              "type": "string"
            },
            "name": {
              "type": "string"
            },
            "code": {
              "type": "string"
            }
          },
          "required": [
            "id",
            "name",
            "code"
          ]
        },
        "created_at": {
          "type": "string",
          "format": "date-time"
        },
        "updated_at": {
          "type": "string",
          "format": "date-time"
        }
      },
      "required": [
        "id",
        "name",
        "code",
        "default",
        "main",
        "rtl",
        "plural_forms",
        "source_locale",
        "fallback_locale",
        "created_at",
        "updated_at"
      ]
    }
  },
  "required": [
    "event",
    "message",
    "user",
    "project",
    "job",
    "locale"
  ]
}
